{
  "$schema": "http://json-schema.org/draft-06/schema#",
  "$ref": "#/definitions/Welcome",
  "definitions": {
      "Welcome": {
          "type": "object",
          "additionalProperties": false,
          "properties": {
              "fontFamilies": {
                  "$ref": "#/definitions/FontFamilies"
              },
              "lineHeights": {
                  "type": "object",
                  "additionalProperties": {
                      "$ref": "#/definitions/Ciscosans"
                  }
              },
              "fontWeights": {
                  "$ref": "#/definitions/FontWeights"
              },
              "fontSize": {
                  "type": "object",
                  "additionalProperties": {
                      "$ref": "#/definitions/Ciscosans"
                  }
              },
              "letterSpacing": {
                  "$ref": "#/definitions/Spacing"
              },
              "paragraphSpacing": {
                  "$ref": "#/definitions/Spacing"
              },
              "apps": {
                  "type": "object",
                  "additionalProperties": {
                      "$ref": "#/definitions/App"
                  }
              },
              "textCase": {
                  "$ref": "#/definitions/TextCaseClass"
              },
              "textDecoration": {
                  "$ref": "#/definitions/TextDecorationClass"
              }
          },
          "required": [
              "apps",
              "fontFamilies",
              "fontSize",
              "fontWeights",
              "letterSpacing",
              "lineHeights",
              "paragraphSpacing",
              "textCase",
              "textDecoration"
          ],
          "title": "Welcome"
      },
      "App": {
          "type": "object",
          "additionalProperties": false,
          "properties": {
              "value": {
                  "$ref": "#/definitions/Value"
              },
              "type": {
                  "$ref": "#/definitions/Type"
              },
              "description": {
                  "type": "string"
              }
          },
          "required": [
              "description",
              "type",
              "value"
          ],
          "title": "App"
      },
      "Value": {
          "type": "object",
          "additionalProperties": false,
          "properties": {
              "fontFamily": {
                  "$ref": "#/definitions/FontFamily"
              },
              "fontWeight": {
                  "$ref": "#/definitions/FontWeight"
              },
              "lineHeight": {
                  "type": "string"
              },
              "fontSize": {
                  "type": "string"
              },
              "letterSpacing": {
                  "$ref": "#/definitions/LetterSpacing"
              },
              "paragraphSpacing": {
                  "$ref": "#/definitions/ParagraphSpacing"
              },
              "paragraphIndent": {
                  "type": "string"
              },
              "textCase": {
                  "$ref": "#/definitions/TextCaseEnum"
              },
              "textDecoration": {
                  "$ref": "#/definitions/TextDecorationEnum"
              }
          },
          "required": [
              "fontFamily",
              "fontSize",
              "fontWeight",
              "letterSpacing",
              "lineHeight",
              "paragraphIndent",
              "paragraphSpacing",
              "textCase",
              "textDecoration"
          ],
          "title": "Value"
      },
      "FontFamilies": {
          "type": "object",
          "additionalProperties": false,
          "properties": {
              "ciscosanstt": {
                  "$ref": "#/definitions/Ciscosans"
              },
              "ciscosans": {
                  "$ref": "#/definitions/Ciscosans"
              }
          },
          "required": [
              "ciscosans",
              "ciscosanstt"
          ],
          "title": "FontFamilies"
      },
      "Ciscosans": {
          "type": "object",
          "additionalProperties": false,
          "properties": {
              "value": {
                  "type": "string"
              },
              "type": {
                  "type": "string"
              }
          },
          "required": [
              "type",
              "value"
          ],
          "title": "Ciscosans"
      },
      "FontWeights": {
          "type": "object",
          "additionalProperties": false,
          "properties": {
              "ciscosanstt-0": {
                  "$ref": "#/definitions/Ciscosans"
              },
              "ciscosanstt-1": {
                  "$ref": "#/definitions/Ciscosans"
              },
              "ciscosans-2": {
                  "$ref": "#/definitions/Ciscosans"
              },
              "ciscosanstt-3": {
                  "$ref": "#/definitions/Ciscosans"
              },
              "ciscosanstt-4": {
                  "$ref": "#/definitions/Ciscosans"
              }
          },
          "required": [
              "ciscosans-2",
              "ciscosanstt-0",
              "ciscosanstt-1",
              "ciscosanstt-3",
              "ciscosanstt-4"
          ],
          "title": "FontWeights"
      },
      "Spacing": {
          "type": "object",
          "additionalProperties": false,
          "properties": {
              "0": {
                  "$ref": "#/definitions/Ciscosans"
              }
          },
          "required": [
              "0"
          ],
          "title": "Spacing"
      },
      "TextCaseClass": {
          "type": "object",
          "additionalProperties": false,
          "properties": {
              "none": {
                  "$ref": "#/definitions/Ciscosans"
              }
          },
          "required": [
              "none"
          ],
          "title": "TextCaseClass"
      },
      "TextDecorationClass": {
          "type": "object",
          "additionalProperties": false,
          "properties": {
              "underline": {
                  "$ref": "#/definitions/Ciscosans"
              },
              "none": {
                  "$ref": "#/definitions/Ciscosans"
              }
          },
          "required": [
              "none",
              "underline"
          ],
          "title": "TextDecorationClass"
      },
      "Type": {
          "type": "string",
          "enum": [
              "typography"
          ],
          "title": "Type"
      },
      "FontFamily": {
          "type": "string",
          "enum": [
              "{fontFamilies.ciscosanstt}",
              "{fontFamilies.ciscosans}"
          ],
          "title": "FontFamily"
      },
      "FontWeight": {
          "type": "string",
          "enum": [
              "{fontWeights.ciscosanstt-3}",
              "{fontWeights.ciscosanstt-1}",
              "{fontWeights.ciscosanstt-0}",
              "{fontWeights.ciscosanstt-4}"
          ],
          "title": "FontWeight"
      },
      "LetterSpacing": {
          "type": "string",
          "enum": [
              "{letterSpacing.0}"
          ],
          "title": "LetterSpacing"
      },
      "ParagraphSpacing": {
          "type": "string",
          "enum": [
              "{paragraphSpacing.0}"
          ],
          "title": "ParagraphSpacing"
      },
      "TextCaseEnum": {
          "type": "string",
          "enum": [
              "{textCase.none}"
          ],
          "title": "TextCaseEnum"
      },
      "TextDecorationEnum": {
          "type": "string",
          "enum": [
              "{textDecoration.none}",
              "{textDecoration.underline}"
          ],
          "title": "TextDecorationEnum"
      }
  }
}
