{
  "fontFamilies": {
    "ciscosanstt": {
      "value": "CiscoSansTT",
      "type": "fontFamilies"
    },
    "ciscosans": {
      "value": "CiscoSans",
      "type": "fontFamilies"
    }
  },
  "lineHeights": {
    "0": {
      "value": "16",
      "type": "lineHeights"
    },
    "1": {
      "value": "20",
      "type": "lineHeights"
    },
    "2": {
      "value": "24",
      "type": "lineHeights"
    },
    "3": {
      "value": "28",
      "type": "lineHeights"
    },
    "4": {
      "value": "32",
      "type": "lineHeights"
    },
    "5": {
      "value": "40",
      "type": "lineHeights"
    },
    "6": {
      "value": "52",
      "type": "lineHeights"
    },
    "7": {
      "value": "64",
      "type": "lineHeights"
    }
  },
  "fontWeights": {
    "ciscosanstt-0": {
      "value": "Regular",
      "type": "fontWeights"
    },
    "ciscosanstt-1": {
      "value": "Medium",
      "type": "fontWeights"
    },
    "ciscosans-2": {
      "value": "Regular",
      "type": "fontWeights"
    },
    "ciscosanstt-3": {
      "value": "Bold",
      "type": "fontWeights"
    },
    "ciscosanstt-4": {
      "value": "Light",
      "type": "fontWeights"
    }
  },
  "fontSize": {
    "0": {
      "value": "12",
      "type": "fontSizes"
    },
    "1": {
      "value": "14",
      "type": "fontSizes"
    },
    "2": {
      "value": "16",
      "type": "fontSizes"
    },
    "3": {
      "value": "20",
      "type": "fontSizes"
    },
    "4": {
      "value": "24",
      "type": "fontSizes"
    },
    "5": {
      "value": "32",
      "type": "fontSizes"
    },
    "6": {
      "value": "40",
      "type": "fontSizes"
    },
    "7": {
      "value": "52",
      "type": "fontSizes"
    }
  },
  "letterSpacing": {
    "0": {
      "value": "0%",
      "type": "letterSpacing"
    }
  },
  "paragraphSpacing": {
    "0": {
      "value": "0",
      "type": "paragraphSpacing"
    }
  },
  "apps": {
    "body-underline-small_regular": {
      "value": {
        "fontFamily": "{fontFamilies.ciscosanstt}",
        "fontWeight": "{fontWeights.ciscosanstt-0}",
        "lineHeight": "{lineHeights.0}",
        "fontSize": "{fontSize.0}",
        "letterSpacing": "{letterSpacing.0}",
        "paragraphSpacing": "{paragraphSpacing.0}",
        "paragraphIndent": "{paragraphIndent.0}",
        "textCase": "{textCase.none}",
        "textDecoration": "{textDecoration.underline}"
      },
      "type": "typography",
      "description": "Theme token: body-underline-small_regular; Core token: font-10. Needs prior approval from Momentum team to use."
    },
    "body-underline-small_medium": {
      "value": {
        "fontFamily": "{fontFamilies.ciscosanstt}",
        "fontWeight": "{fontWeights.ciscosanstt-1}",
        "lineHeight": "{lineHeights.0}",
        "fontSize": "{fontSize.0}",
        "letterSpacing": "{letterSpacing.0}",
        "paragraphSpacing": "{paragraphSpacing.0}",
        "paragraphIndent": "{paragraphIndent.0}",
        "textCase": "{textCase.none}",
        "textDecoration": "{textDecoration.underline}"
      },
      "type": "typography",
      "description": "Theme token: body-underline-small_medium; Core token: font-10. Needs prior approval from Momentum team to use."
    },
    "body-underline-midsize_regular": {
      "value": {
        "fontFamily": "{fontFamilies.ciscosanstt}",
        "fontWeight": "{fontWeights.ciscosanstt-0}",
        "lineHeight": "{lineHeights.1}",
        "fontSize": "{fontSize.1}",
        "letterSpacing": "{letterSpacing.0}",
        "paragraphSpacing": "{paragraphSpacing.0}",
        "paragraphIndent": "{paragraphIndent.0}",
        "textCase": "{textCase.none}",
        "textDecoration": "{textDecoration.underline}"
      },
      "type": "typography",
      "description": "Theme token: body-underline-middle_regular; Core token: font-20"
    },
    "body-underline-midsize_medium": {
      "value": {
        "fontFamily": "{fontFamilies.ciscosanstt}",
        "fontWeight": "{fontWeights.ciscosanstt-1}",
        "lineHeight": "{lineHeights.1}",
        "fontSize": "{fontSize.1}",
        "letterSpacing": "{letterSpacing.0}",
        "paragraphSpacing": "{paragraphSpacing.0}",
        "paragraphIndent": "{paragraphIndent.0}",
        "textCase": "{textCase.none}",
        "textDecoration": "{textDecoration.underline}"
      },
      "type": "typography",
      "description": "Theme token: body-underline-middle_medium; Core token: font-20"
    },
    "body-underline-large_regular": {
      "value": {
        "fontFamily": "{fontFamilies.ciscosanstt}",
        "fontWeight": "{fontWeights.ciscosanstt-0}",
        "lineHeight": "{lineHeights.2}",
        "fontSize": "{fontSize.2}",
        "letterSpacing": "{letterSpacing.0}",
        "paragraphSpacing": "{paragraphSpacing.0}",
        "paragraphIndent": "{paragraphIndent.0}",
        "textCase": "{textCase.none}",
        "textDecoration": "{textDecoration.underline}"
      },
      "type": "typography",
      "description": "Theme token: body-underline-large_regular; Core token: font-30"
    },
    "body-underline-large_medium": {
      "value": {
        "fontFamily": "{fontFamilies.ciscosanstt}",
        "fontWeight": "{fontWeights.ciscosanstt-1}",
        "lineHeight": "{lineHeights.2}",
        "fontSize": "{fontSize.2}",
        "letterSpacing": "{letterSpacing.0}",
        "paragraphSpacing": "{paragraphSpacing.0}",
        "paragraphIndent": "{paragraphIndent.0}",
        "textCase": "{textCase.none}",
        "textDecoration": "{textDecoration.underline}"
      },
      "type": "typography",
      "description": "Theme token: body-underline-large_medium; Core token: font-30"
    },
    "body-small_regular": {
      "value": {
        "fontFamily": "{fontFamilies.ciscosans}",
        "fontWeight": "{fontWeights.ciscosanstt-0}",
        "lineHeight": "{lineHeights.0}",
        "fontSize": "{fontSize.0}",
        "letterSpacing": "{letterSpacing.0}",
        "paragraphSpacing": "{paragraphSpacing.0}",
        "paragraphIndent": "{paragraphIndent.0}",
        "textCase": "{textCase.none}",
        "textDecoration": "{textDecoration.none}"
      },
      "type": "typography",
      "description": "Theme token:body-small_regular; Core token: font-10. Needs prior approval from Momentum team to use."
    },
    "body-small_medium": {
      "value": {
        "fontFamily": "{fontFamilies.ciscosanstt}",
        "fontWeight": "{fontWeights.ciscosanstt-1}",
        "lineHeight": "{lineHeights.0}",
        "fontSize": "{fontSize.0}",
        "letterSpacing": "{letterSpacing.0}",
        "paragraphSpacing": "{paragraphSpacing.0}",
        "paragraphIndent": "{paragraphIndent.0}",
        "textCase": "{textCase.none}",
        "textDecoration": "{textDecoration.none}"
      },
      "type": "typography",
      "description": "Theme token:body-small_medium; Core token: font-10. Needs prior approval from Momentum team to use."
    },
    "body-small_bold": {
      "value": {
        "fontFamily": "{fontFamilies.ciscosanstt}",
        "fontWeight": "{fontWeights.ciscosanstt-3}",
        "lineHeight": "{lineHeights.0}",
        "fontSize": "{fontSize.0}",
        "letterSpacing": "{letterSpacing.0}",
        "paragraphSpacing": "{paragraphSpacing.0}",
        "paragraphIndent": "{paragraphIndent.0}",
        "textCase": "{textCase.none}",
        "textDecoration": "{textDecoration.none}"
      },
      "type": "typography",
      "description": "Theme token:body-small_bold; Core token: font-10. Needs prior approval from Momentum team to use."
    },
    "body-midsize_regular": {
      "value": {
        "fontFamily": "{fontFamilies.ciscosanstt}",
        "fontWeight": "{fontWeights.ciscosanstt-0}",
        "lineHeight": "{lineHeights.1}",
        "fontSize": "{fontSize.1}",
        "letterSpacing": "{letterSpacing.0}",
        "paragraphSpacing": "{paragraphSpacing.0}",
        "paragraphIndent": "{paragraphIndent.0}",
        "textCase": "{textCase.none}",
        "textDecoration": "{textDecoration.none}"
      },
      "type": "typography",
      "description": "Theme token: body-middle_regular; Core token: font-20"
    },
    "body-midsize_medium": {
      "value": {
        "fontFamily": "{fontFamilies.ciscosanstt}",
        "fontWeight": "{fontWeights.ciscosanstt-1}",
        "lineHeight": "{lineHeights.1}",
        "fontSize": "{fontSize.1}",
        "letterSpacing": "{letterSpacing.0}",
        "paragraphSpacing": "{paragraphSpacing.0}",
        "paragraphIndent": "{paragraphIndent.0}",
        "textCase": "{textCase.none}",
        "textDecoration": "{textDecoration.none}"
      },
      "type": "typography",
      "description": "Theme token: body-middle_medium; Core token: font-20"
    },
    "body-midsize_bold": {
      "value": {
        "fontFamily": "{fontFamilies.ciscosanstt}",
        "fontWeight": "{fontWeights.ciscosanstt-3}",
        "lineHeight": "{lineHeights.1}",
        "fontSize": "{fontSize.1}",
        "letterSpacing": "{letterSpacing.0}",
        "paragraphSpacing": "{paragraphSpacing.0}",
        "paragraphIndent": "{paragraphIndent.0}",
        "textCase": "{textCase.none}",
        "textDecoration": "{textDecoration.none}"
      },
      "type": "typography",
      "description": "Theme token: body-middle_bold; Core token: font-20"
    },
    "body-large_regular": {
      "value": {
        "fontFamily": "{fontFamilies.ciscosans}",
        "fontWeight": "{fontWeights.ciscosanstt-0}",
        "lineHeight": "{lineHeights.2}",
        "fontSize": "{fontSize.2}",
        "letterSpacing": "{letterSpacing.0}",
        "paragraphSpacing": "{paragraphSpacing.0}",
        "paragraphIndent": "{paragraphIndent.0}",
        "textCase": "{textCase.none}",
        "textDecoration": "{textDecoration.none}"
      },
      "type": "typography",
      "description": "Theme token: body-large_regular; Core token: font-30"
    },
    "body-large_medium": {
      "value": {